{
  "issuer": "urn:be:t-test:iam",
  "jwks_uri": "http://infra-iam-casdoor-3-0-0:8200/.well-known/jwks.json",
  "token_endpoint": "/api/iam/token",
  "grant_types_supported": ["urn:ietf:params:oauth:grant-type:token-exchange", "refresh_token"],
  "token_endpoint_auth_methods_supported": ["none"],
  "id_token_signing_alg_values_supported": ["RS256"],
  "be_contract": "iam/1.0",
  "be_member": { "id": "infra/iam-casdoor", "version": "3.0.0" },
  "be_capabilities": ["core", "password_login", "social_cn"],
  "be_tenant_id": "t-test",
  "be_access_token_ttl_seconds": 600
}
